{
  "schemaVersion": "0.1.0-draft",
  "mode": "acceptance",
  "goalId": "GOAL-008-r6-integration-acceptance-vp-evidence",
  "workspaceId": "workspace-001-mvp-admin-foundation",
  "vpId": "VP-001-mvp-admin-foundation",
  "repositoryRevision": "a941bedb1fc2cd4859a408df50653e867da35ff2",
  "worktreeState": "clean",
  "startedAt": "2026-08-01T05:54:00+08:00",
  "completedAt": "2026-08-01T05:58:00+08:00",
  "environmentRef": "windows/amd64; node v22.17.0; npm 10.9.2; go1.26.0; vitest 3.2.7; playwright 1.62.1",
  "rerunRules": [
    "Run each command from the recorded cwd against one repository revision.",
    "Record the environment and worktree state before execution.",
    "Persist result artifacts before calculating SHA-256; missing artifacts remain explicit.",
    "Do not combine results from different revisions or environments."
  ],
  "results": [
    {
      "id": "web-test",
      "claimRefs": [
        "C-001",
        "C-005",
        "C-007",
        "VP-001.exit-1",
        "VP-001.exit-2",
        "VP-001.exit-3"
      ],
      "command": "npm test",
      "cwd": "apps/web",
      "exitCode": 0,
      "outcome": "pass",
      "artifact": "evidence/acceptance/results/web-test.log",
      "artifactStatus": "verified",
      "sha256": "6af00599310246d89923b7007ae98e95c4197bb73717f924f57473d0eeb65e6c"
    },
    {
      "id": "web-build",
      "claimRefs": [
        "C-001",
        "VP-001.exit-1"
      ],
      "command": "npm run build",
      "cwd": "apps/web",
      "exitCode": 0,
      "outcome": "pass",
      "artifact": "evidence/acceptance/results/web-build.log",
      "artifactStatus": "verified",
      "sha256": "399e6f5b74267af102c4f402ed4bcfc60c063a8eed1f51c3286e228f2c77dd4a"
    },
    {
      "id": "api-test",
      "claimRefs": [
        "C-002",
        "C-005",
        "VP-001.exit-1"
      ],
      "command": "go test ./...",
      "cwd": "apps/api",
      "exitCode": 0,
      "outcome": "pass",
      "artifact": "evidence/acceptance/results/api-test.log",
      "artifactStatus": "verified",
      "sha256": "1354260d1256563ae553eef8eaf96a833aa39fe3222988885bea28502133c1a4"
    },
    {
      "id": "api-build",
      "claimRefs": [
        "C-002",
        "VP-001.exit-1"
      ],
      "command": "go build ./...",
      "cwd": "apps/api",
      "exitCode": 0,
      "outcome": "pass",
      "artifact": "evidence/acceptance/results/api-build.log",
      "artifactStatus": "verified",
      "sha256": "19eaf43821a7660ec323a87c8457bf74823beb296c39f5e01aa8a683aa50f061"
    },
    {
      "id": "runtime-probes",
      "claimRefs": [
        "C-003",
        "C-005",
        "VP-001.exit-1",
        "VP-001.exit-3"
      ],
      "command": "dual-service startup + HTTP probes (see log)",
      "cwd": "repo-root",
      "exitCode": 0,
      "outcome": "pass",
      "artifact": "evidence/acceptance/results/runtime-probes.log",
      "artifactStatus": "verified",
      "sha256": "45317ea2c39c2f0b7f2899d5f5d8411df76715945e81a22c078dc63588786ea8"
    },
    {
      "id": "browser-e2e",
      "claimRefs": [
        "C-004",
        "C-005",
        "VP-001.exit-1",
        "VP-001.exit-3"
      ],
      "command": "npm run test:e2e (Playwright Chromium)",
      "cwd": "apps/web",
      "exitCode": 0,
      "outcome": "pass",
      "artifact": "evidence/acceptance/results/browser-e2e.json",
      "artifactStatus": "verified",
      "sha256": "eaf82da486d32ebdfe9fb0847e01a64fa3b5f27f1e030f12b85833d8de16c923"
    },
    {
      "id": "browser-screenshot",
      "claimRefs": [
        "C-004",
        "VP-001.exit-1"
      ],
      "command": "Playwright screenshot (r6-overview.png)",
      "cwd": "apps/web",
      "exitCode": 0,
      "outcome": "pass",
      "artifact": "evidence/acceptance/results/r6-overview.png",
      "artifactStatus": "verified",
      "sha256": "baaab8ec7ba49a68aa75269840f23e10da29ad9861c4f4745942ec6e3a998441"
    }
  ],
  "exclusions": [
    {
      "id": "reactions-multiround-excluded",
      "scope": "D-EXPR upstream reactions suite (16/16)",
      "reason": "Upstream multi-round $deps writer semantics are not in the MVP $context subset (Root D-008); MVP formal entry is reactions.test.ts + /form-with-reactions.",
      "reviewTrigger": "Re-evaluate if MVP $context subset expands to multi-round $deps."
    },
    {
      "id": "request-construction-batch-excluded",
      "scope": "D-DATA request-construction batch cases (11)",
      "reason": "Batch request construction excluded from MVP (Root D-010 Q1=否); non-batch 64/64 executed within npm test stage3.",
      "reviewTrigger": "Re-evaluate when batch semantics are scoped."
    },
    {
      "id": "uploads-domain-excluded",
      "scope": "D-UPLOAD",
      "reason": "Upload domain excluded from MVP coverage (I-PROTO-001 v0.1.3).",
      "reviewTrigger": "Only if upload becomes an MVP scope."
    },
    {
      "id": "local-not-clean-install",
      "scope": "I-008-002 local run",
      "reason": "This local acceptance run reused the existing dependency tree; clean install (npm ci) is evidenced by the GitHub Actions run (30667596846) on Linux.",
      "reviewTrigger": "Re-run local clean install if dependency tree changes materially."
    },
    {
      "id": "denial-path-browser-not-asserted",
      "scope": "C-006 browser-level denial",
      "reason": "The real manifest has no permission-gated navigation item; shell denial is asserted at renderer/component level (App.integration.test, D-PERM fixtures) per account-permission-oracle D-1..D-6, not in a browser E2E.",
      "reviewTrigger": "If a permission-gated nav item is added to the real manifest."
    }
  ],
  "residuals": [],
  "overallOutcome": "pass"
}
